name,price,derive,sales,photo
多功能组合工具箱户外工具装备套装防灾急救车载应急箱子,346.00,拓野者户外专营店,591,https://img3m5.ddimg.cn/44/19/1047947615-1_b_1.jpg
随时携带钳子钢丝钳户外工具带灯工具钳子多功能钳万用钳老虎钳,239.00,拓野者户外专营店,287,https://img3m9.ddimg.cn/44/24/1462831469-1_b_1.jpg
工具车载应急箱子多功能组合工具箱户外工具装备套装防灾急救,439.00,拓野者户外专营店,390,https://img3m9.ddimg.cn/14/20/1460333669-1_b_1.jpg
户外登山野营用品铲子加长节工兵铲手柄户外工具铲加长杆工兵,140.00,拓野者户外专营店,818,https://img3m7.ddimg.cn/16/25/1454638597-1_b_1.jpg
多功能折刀 快开刀 野营刀具 全金属折叠刀户外工具水果刀探险刀 救生刀 防身刀 快递刀 收藏刀 礼品刀,88.00,cold archery旗舰店,768,https://img3m1.ddimg.cn/57/32/11424168021-1_b_1.jpg
cold archery 复古黄铜口哨 手工黄铜哨 求生哨子 裁判口哨 比赛哨 钥匙扣挂件户外用品EDC工具送链子,15.00,cold archery旗舰店,451,https://img3m1.ddimg.cn/17/33/11169825101-1_b_1.jpg
cold archery 线锯不锈钢丝锯绳链线锯救生锯野营用品户外求生工具丝锯 链锯 绳锯 钢丝锯 救生锯360度旋转,15.00,cold archery旗舰店,924,https://img3m1.ddimg.cn/93/5/11381823381-1_b_1.jpg
cold archery户外多功能六角扳手螺丝刀撬棒钥匙挂件工具不锈钢多用途尖刺 扳手 开瓶器 改锥,16.00,cold archery旗舰店,300,https://img3m1.ddimg.cn/17/7/11387853791-1_b_1.jpg
cold archery 多功能登山扣承重滑轮户外合金挂扣专业快挂加强版金属扳手工具,36.00,cold archery旗舰店,962,https://img3m1.ddimg.cn/44/24/11387854511-1_b_1.jpg
户外铲工具箱套装 多功能铲子组合工具斧子工具钳棍子车载箱,1188,拓野者户外专营店,766,https://img3m5.ddimg.cn/50/25/1046621615-1_b_1.jpg
多功能折刀水果刀工具刀户外露营求生刀 木柄随身小刀户外野营刀 防身刀 快递刀 折叠刀,88.00,cold archery旗舰店,118,https://img3m1.ddimg.cn/26/5/11423953061-1_b_1.jpg
户外刀具防护折叠刀开箱工具小刀便携多功能水果刀防身求生折刀,90.00,cold archery旗舰店,251,https://img3m1.ddimg.cn/38/6/11419279481-1_b_1.jpg
大马士革刀野营刀多功能工具刀水果刀户外刀便携迷你钥匙扣刀 野营自驾刀 防身刀 快递刀收藏礼品刀,180.00,cold archery旗舰店,443,https://img3m1.ddimg.cn/53/22/11460473891-1_b_1.jpg
外星坦克钛合金折刀户外折叠刀防身刀野营工具刀 战术高硬度折刀EDC户外野外露营刀具探险求生刀收藏实用折刀,448.00,cold archery旗舰店,251,https://img3m1.ddimg.cn/69/15/11689349631-1_b_1705387317.jpg
多功能折刀水果刀户外野营工具刀户外野营刀 防卫刀 探险刀 救生刀 收藏礼品刀户外随身防身小刀 折叠刀,130.00,cold archery旗舰店,353,https://img3m1.ddimg.cn/84/32/11413185681-1_b_1.jpg
小刀户外折叠刀EDC锋利高硬度便携随身小工具野外折刀 防身刀 快递刀 便携随身刀,50.00,cold archery旗舰店,919,https://img3m1.ddimg.cn/77/19/11467150871-1_b_2.jpg
cold archery TC4钛合金创意迷你开瓶器开罐器不锈钢多功能钥匙扣户外EDC小工具一字起子 送钥匙圈,17.00,cold archery旗舰店,679,https://img3m1.ddimg.cn/31/1/11387855191-1_b_1.jpg
狐狸多功能刀高硬度户外小直刀随身便携战术装备 防身工具刀野外露营探险求生刀,400.00,cold archery旗舰店,856,https://img3m1.ddimg.cn/44/11/11467326761-1_b_1.jpg
迷你钥匙小刀随身便携折叠刀具水果刀野营户外求生工具刀 防身刀 快递刀,58.00,cold archery旗舰店,479,https://img3m1.ddimg.cn/14/32/11467162391-1_b_1.jpg
大马士革钢刀鲍贝/红科檀木柄口袋刀多功能高硬度锋利折叠刀具户外随身工具户外多功能折刀野营刀具 收藏礼品刀具 快递刀,300.00,cold archery旗舰店,508,https://img3m1.ddimg.cn/98/33/11459295341-1_b_1.jpg
cold archery TC4钛合金钥匙扣钥匙环快挂 锁匙链钛合金钥匙扣 腰带挂扣 八角形挂扣户外EDC小工具,18.00,cold archery旗舰店,737,https://img3m1.ddimg.cn/49/27/11169989671-1_b_1.jpg
cold archery 金属双孔高分贝求生口哨户外自救哨高音高频铝合金求助便携哨 生存救生哨子装备 EDC工具,15.00,cold archery旗舰店,301,https://img3m1.ddimg.cn/28/4/11169824221-1_b_1.jpg
户外水果刀多功能折叠刀荒野求生高硬度锋利刀野外随身小刀具高硬度锋利折刀野营刀具 防身刀 快递刀 登山工具刀,160.00,cold archery旗舰店,180,https://img3m1.ddimg.cn/23/8/11424127001-1_b_2.jpg
cold archery户外收纳包 钥匙包工具通勤装备包 迷彩战术附件副包 零钱包,20.00,cold archery旗舰店,355,https://img3m1.ddimg.cn/85/25/11387853661-1_b_1.jpg
cold archery户外随身小工具八爪鱼自行车多功能修理工具字梅花螺丝刀12功能用途螺丝刀,18.00,cold archery旗舰店,749,https://img3m1.ddimg.cn/65/33/11387854631-1_b_1.jpg
维修工具户外家用组合工具套装自行车修车工具维修保养多功能工具配件,408.00,拓野者户外专营店,177,https://img3m9.ddimg.cn/66/31/1443013869-1_b_1.jpg
便携户外攻击斧子钳棍子车载箱户外铲工具箱套装多功能铲子组合工具,1798,拓野者户外专营店,363,https://img3m9.ddimg.cn/57/31/1463060469-1_b_1.jpg
多功能钥匙扣开瓶器随身便携迷你袖珍组合工具户外露营登山扣圈,56.00,拓野者户外专营店,890,https://img3m5.ddimg.cn/94/4/1302451915-1_b_1.jpg
户外野营工具钳子锤羊角锤斧头锤可折叠 安全锤救生锤破窗,210.00,拓野者户外专营店,865,https://img3m9.ddimg.cn/1/16/1362827269-1_b_1.jpg
户外求生工具大号粗配口哨配指南针打火镁棒打火石加,160.00,拓野者户外专营店,913,https://img3m7.ddimg.cn/33/5/1476766797-1_b_1.jpg
大气美观开瓶器起子口袋工具钛合金多功能钥匙扣工具户外EDC组合工具,245.00,拓野者户外专营店,382,https://img3m9.ddimg.cn/60/12/1460625369-1_b_1.jpg
钳子便携工具钳子折叠多用钳组合工具户外野营装备侧开多功能钳,245.00,拓野者户外专营店,685,https://img3m9.ddimg.cn/38/23/1462712069-1_b_1.jpg
户外维修工具自行车工具箱套装修车修理山地车工具包骑行装备配件,456.00,拓野者户外专营店,569,https://img3m9.ddimg.cn/63/30/1440241569-1_b_1.jpg
户外自行车包工具包梁备三角单车上管包包车前包山地车包骑行装,160.00,拓野者户外专营店,777,https://img3m7.ddimg.cn/55/0/1384887097-1_b_1.jpg
休闲包户外大腰包工具包多功能路亚腰包挎包竿包钓鱼包矶钓包渔具包,279.00,拓野者户外专营店,606,https://img3m5.ddimg.cn/13/6/1061854015-1_b_1.jpg
户外尾包便携式工具包山地车自行车补胎工具套装骑行横梁包,179.00,拓野者户外专营店,160,https://img3m9.ddimg.cn/62/2/1440380069-1_b_1.jpg
户外装备盒求生盒 便携收纳盒工具盒包装盒防雨水盒整理盒,26.00,拓野者户外专营店,319,https://img3m5.ddimg.cn/22/16/1048074115-1_b_1.jpg
户外自行车拆卸工具合山地车补胎工具套装单车修理骑行装备修车便携组,140.00,拓野者户外专营店,786,https://img3m7.ddimg.cn/79/34/1383651997-1_b_1.jpg
户外自行车修车架维修台车工具架死飞修理台单车工作台展示架山地车修,386.00,拓野者户外专营店,930,https://img3m7.ddimg.cn/52/28/1384866997-1_b_1.jpg
户外自行车线管剪线钳车工具山地车线管钳刹车变速线管剪内线钢丝剪修,180.00,拓野者户外专营店,114,https://img3m7.ddimg.cn/42/0/1384905597-1_b_1.jpg
户外多用途自行车维修工具包补胎打气筒修理扳手套装山地车组合工具,139.00,拓野者户外专营店,577,https://img3m9.ddimg.cn/38/5/1258465169-1_b_1.jpg
户外四件套和2L大口水袋 套装户外骑车饮水工具水袋和清洁刷子,95.00,拓野者户外专营店,795,https://img3m5.ddimg.cn/94/23/1303699315-1_b_1.jpg
户外教练推荐艾扬格瑜伽椅 用品工具健身椅辅助椅瑜伽辅助折叠椅辅助,386.00,拓野者户外专营店,381,https://img3m7.ddimg.cn/68/21/1337625797-1_b_1.jpg
户外单车包自行车尾包 鞍座包工具包 坐垫包 车包 骑行装备,139.00,拓野者户外专营店,865,https://img3m9.ddimg.cn/76/6/1441886269-1_b_1.jpg
户外钓鱼渔具配件盒防水小路亚盒工具盒储物盒鱼钩收纳盒鱼具,44.00,拓野者户外专营店,849,https://img3m5.ddimg.cn/77/24/1002668315-1_b_1.jpg
家用户外自行车修车多功能组合工具箱套装修理工具配件大工具装备,385.00,拓野者户外专营店,761,https://img3m9.ddimg.cn/84/6/1442748369-1_b_1.jpg
户外运动炫彩自行车尾包山地车包工具包骑行包尾包,50.00,拓野者户外专营店,931,https://img3m5.ddimg.cn/83/31/1419221315-1_b_1.jpg
简约大气户外便携罐硬壳水壶修车工具便携储物盒自行车包工具,168.00,拓野者户外专营店,435,https://img3m9.ddimg.cn/94/5/1261569469-1_b_1.jpg
工具套装旅行车载求生组合箱多功能急救装备野外生存工具盒户外探险套装,269.00,拓野者户外专营店,683,https://img3m9.ddimg.cn/40/5/1469394769-1_b_2.jpg
多功能兵工铲子铲户外露营防身用品工具自驾野营折叠防身月牙,386.00,拓野者户外专营店,312,https://img3m7.ddimg.cn/17/25/1454608997-1_b_1.jpg
高硬度便携户外修车内六角扭力多功能组合工具套装双向棘轮扳手组套筒,385.00,拓野者户外专营店,440,https://img3m9.ddimg.cn/44/19/1258416269-1_b_1.jpg
后座包单车小包户外小巧自行车尾包鞍座包工具尾包坐垫尾包自行车配件,158.00,拓野者户外专营店,303,https://img3m9.ddimg.cn/85/22/1443807769-1_b_1.jpg
应急便携随身户外安全锤3合一多功能汽车救生工具锤 安全锤,139.00,拓野者户外专营店,991,https://img3m9.ddimg.cn/13/21/1175312569-1_b_1.jpg
应急锤子野外救生锤子多功能铝合金户外锤 野营装备工具野外求生装备,225.00,拓野者户外专营店,934,https://img3m9.ddimg.cn/94/20/1355401669-1_b_1.jpg
猛蛇工具钳 多功能钳子组合户外装备折叠钳野营多用便携钳子,76.00,拓野者户外专营店,900,https://img3m5.ddimg.cn/42/8/1052065815-1_b_1.jpg
梅西熊喷犬兽驱散喷雾防烈性犬防咬猫狗驱犬防护防身家用外出安全保障器材防卫防身用品工具器材户外野营兽全年驱散器 大容量防,300.00,cold archery旗舰店,895,https://img3m1.ddimg.cn/76/29/12325094671-1_b_1744864774.jpg
家用3人-5人木炭烧烤工具野外碳烤炉全套烧烤炉户外烧烤架,319.00,拓野者户外专营店,432,https://img3m5.ddimg.cn/74/25/1372284515-1_b_1.jpg
多功能钳子折叠钳野营多用便携钳子猛蛇工具钳多功能钳子组合户外装备,179.00,拓野者户外专营店,789,https://img3m9.ddimg.cn/48/24/1463079369-1_b_1.jpg
工具手电筒USB充电小手电便携迷你手电户外强光照明可充电手电筒,239.00,拓野者户外专营店,492,https://img3m9.ddimg.cn/69/22/1463695269-1_b_1.jpg
户外指南针（指北针）带阻尼夜光驴友野外方向工具怀表式带扣,48.00,拓野者户外专营店,744,https://img3m5.ddimg.cn/79/32/1306450015-1_b_1.jpg
